{
  "$schema": "http://json-schema.org/draft-07/schema#",
  "type": "array",
  "items": {
    "type": "object",
    "properties": {
      "id": { "type": "string" },
      "title": { "type": "string" },
      "category": { "type": "string" },
      "content": { "type": "string" },
      "severity": { "type": "string" },
      "tags": { "type": "array", "items": { "type": "string" } },
      "status": { "type": "string" }
    },
    "required": ["id", "title", "category", "content"],
    "additionalProperties": false
  }
} 